Unnamed: 0,term,pos,definition,domain,plural,plurality_of_term,obsolete,archaic,abbreviation,abbreviation_for_term,slang,misspelling,misspelling_for_term,initialism,initialism_for_term,vulgar,synonym,synonym_for_term,attribute,property,process,matter,role,measure,units,body,main_noun_nltk,main_noun_maria,field
23933,ethnoornithology,Noun,The study of the relationship between birds and people.,,False,,False,False,False,,False,False,,False,,False,False,,False,False,False,False,False,False,False,False,study,study,True
23935,ethnopedology,Noun,The study of local (indigenous) knowledge of soils,,False,,False,False,False,,False,False,,False,,False,False,,False,False,False,False,False,False,False,False,study,study,True
23946,ethnopharmacology,Noun,"The scientific study correlating ethnic groups, their health, and how it relates to their physical habits and methodology in creating and using medicines.",,False,,False,False,False,,False,False,,False,,False,False,,False,False,False,False,False,False,False,False,study,study,True
23947,ethnopharmacy,Noun,An interdisciplinary science that investigates the perception and use of pharmaceuticals (especially traditional medicines) in human society.,,False,,False,False,False,,False,False,,False,,False,False,,False,False,False,False,False,False,False,False,science,science,True
23959,ethnophilosophy,Noun,The study of indigenous philosophical systems associated with specific ethnic groups.,,False,,False,False,False,,False,False,,False,,False,False,,False,False,False,False,False,False,False,False,study,study,True
23976,ethnoprimatology,Noun,The study of interactions between humans and other primates,biology,False,,False,False,False,,False,False,,False,,False,False,,False,False,False,False,False,False,False,False,study,study,True
23982,ethnopsychology,Noun,The scientific study of psychological concepts as they exist across different ethnic groups.,,False,,False,False,False,,False,False,,False,,False,False,,False,False,False,False,False,False,False,False,study,study,True
23984,ethnopsychopharmacology,Noun,The study of how psychopharmacology varies across ethnic groups.,,False,,False,False,False,,False,False,,False,,False,False,,False,False,False,False,False,False,False,False,study,study,True
23998,ethnoscience,Noun,The scientific study of ethnic cultures.,,False,,False,False,False,,False,False,,False,,False,False,,False,False,False,False,False,False,False,False,study,study,True
24022,ethnostatistics,Noun,The study of of the social forces that influence the production of statistics.,sociology,False,,False,False,False,,False,False,,False,,False,False,,False,False,False,False,False,False,False,False,study,study,True
24033,ethnozoology,Noun,The study of past and present interrelationships between human cultures and animals.,,False,,False,False,False,,False,False,,False,,False,False,,False,False,False,False,False,False,False,False,study,study,True
24038,ethography,Noun,The study and recording of moral behaviour and human manners,,False,,False,False,False,,False,False,,False,,False,False,,False,False,False,False,False,False,False,False,study,study,True
24048,ethology,Noun,The scientific study of human and animal behaviour.,zoology,False,,False,False,False,,False,False,,False,,False,False,,False,False,False,False,False,False,False,False,study,study,True
24051,ethopharmacology,Noun,The study of the effects of pharmaceutical drugs on behaviour,,False,,False,False,False,,False,False,,False,,False,False,,False,False,False,False,False,False,False,False,study,study,True
24416,etymology,Noun,"The study of the historical development of languages, particularly as manifested in individual words.",uncountable,False,,False,False,False,,False,False,,False,,False,False,,False,False,False,False,False,False,False,False,study,study,True
24451,eubiotics,Noun,The science of hygienic and healthy living.,,False,,False,False,False,,False,False,,False,,False,False,,False,False,False,False,False,False,False,False,science,science,True
24694,eugenics,Noun,"The science of improving stock, whether human or animal.",biology,False,,False,False,False,,False,False,,False,,False,False,,False,False,False,False,False,False,False,False,science,science,True
25032,euphenics,Noun,The science of making biological (phenotypic) improvements to humans after birth.,,False,,False,False,False,,False,False,,False,,False,False,,False,False,False,False,False,False,False,False,science,science,True
25509,euthenics,Noun,The study of the effects of place on people.,,False,,False,False,False,,False,False,,False,,False,False,,False,False,False,False,False,False,False,False,study,study,True
25510,euthenics,Noun,The study of improvement of human function when their environment improves.,,False,,False,False,False,,False,False,,False,,False,False,,False,False,False,False,False,False,False,False,study,study,True
26940,exact science,Noun,"A mathematical science, i.e. a field of science such as mathematics or mathematical physics which is capable of perfectly exact results based on rigorously formal methods.","sciences, narrowly",False,,False,False,False,,False,False,,False,,False,False,,False,False,False,False,False,False,False,False,science,science,True
27165,exanthematology,Noun,The study of exanthem.,,False,,False,False,False,,False,False,,False,,False,False,,False,False,False,False,False,False,False,False,study,study,True
27695,excitonics,Noun,The study of excitons.,physics,False,,False,False,False,,False,False,,False,,False,False,,False,False,False,False,False,False,False,False,study,study,True
28257,exegetics,Noun,The science of interpretation or exegesis.,,False,,False,False,False,,False,False,,False,,False,False,,False,False,False,False,False,False,False,False,science,science,True
28259,exegetist,Noun,One versed in the science of exegesis or interpretation.,,False,,False,False,False,,False,False,,False,,False,False,,False,False,False,False,False,False,False,False,science,science,True
29041,exoconsciousness,Noun,"The study of extraterrestrial dimensions of human consciousness: the origins, dimensions, endowments and abilities of human consciousness that link us directly to the cosmos and its inhabitants.",,False,,False,False,False,,False,False,,False,,False,False,,False,False,False,False,False,False,False,False,study,study,True
29059,exocrinology,Noun,"The study of external (exocrine) secretions, especially of pheromones",,False,,False,False,False,,False,False,,False,,False,False,,False,False,False,False,False,False,False,False,study,study,True
29181,exogeography,Noun,The study of the physical structure and inhabitants outside the Earth.,,False,,False,False,False,,False,False,,False,,False,False,,False,False,False,False,False,False,False,False,study,study,True
1042,paedopsychology,Noun,"The systematic study or theoretical consideration of the nature, functioning, and development of the minds (or, more rarely, the souls) of children and/or infants; child psychology. 1935, United States Office of Education, Bulletin, page 67: Paedopsychology and pathological psychology 1981, Raquel Bialik, Broadening Health Possibilities among a Marginal Urban Community in Mexico City: El Taller de Salud, page 3: Each one of our working areas, instead of being called, let us say, Paidopsychology Laboratory or the Gynecology exploration room, are named: The childrens corner or The Lupes. 1984, Marie Kyralov and Jana Pvratsk (editors), Symposium Comenianum 1982, page 84: Frantiek Cda (18651918) found the historical sources of prewar paedopsychology primarily in Comenius and Rousseau. 1986, Freddy Deven and Robert L. Cliquet (editors), One-Parent Families in Europe: Trends, experiences, implications, page 133: There werestudies in the field of social pathology, pedagogics, pediatrics and paedopsychology. 2013, Jairzinho Lopes Pereira, Augustine of Hippo and Martin Luther on Original Sin and Justification of the Sinner, part I, chapter 3, 3.4, page 196: Original Sin is at the core of what can be called the Augustinian behavioural paedopsychology. His conclusions on the issue may provide some links even for contemporary debates among paedopsychologists.167 [] Daniel Dombrowski criticizes both Augustines view on children and Colin Starnes approval of the same view bringing to the discussion the genetic epistemology of the giant of paedopsychology, the Swiss psychologist and Philosopher Jean Piaget. For more examples of usage of this term, see Citations:paedopsychology.",,False,,False,False,False,,False,False,,False,,False,False,,False,False,False,False,False,False,False,False,study,study,True
1331,paideutics,Noun,The science or art of teaching.,dated,False,,False,False,False,,False,False,,False,,False,False,,False,False,False,False,False,False,False,False,science,science,True
1834,paktorlogy,Noun,"the study of dating, courtship. 2010, Sylvia Toh Paik Choo, The Complete Eh, Goondu!, Google Books Paktology: the name of the dating game, from pak tor (Cantonese) to go steady, smooch and whatever turns you on. [1] 2012, June 14, Jia Yiing Ho, Paktology Lesson 1: Communication, blog entry I welcome you to be my Paktology coursemate via email [2] 2015, February 13, Unnamed, First Vday together? Then stay away from These 5 Movie types, online Years of research in the scientific field of 'paktohlogy' have shown that horror movies are the best to watch on a date. [3] 2016, May 9, Gwee Li Sui, SinGweesh on Wednesday: Horrigible, online So paktorlogy is the science of courtship simple, right? [4]","Singapore, colloquial, humorous",False,,False,False,False,,False,False,,False,,False,False,,False,False,False,False,False,False,False,False,study,study,True
1919,palaeobiology,Noun,"The scientific study of prehistoric life, especially of those aspects pertaining to living systems.",,False,,False,False,False,,False,False,,False,,False,False,,False,False,False,False,False,False,False,False,study,study,True
1949,palaeoclimatology,Noun,The scientific study of prehistoric climate of the Earth.,,False,,False,False,False,,False,False,,False,,False,False,,False,False,False,False,False,False,False,False,study,study,True
1985,palaeoecology,Noun,The study of past ecologies by using the evidence of fossils,,False,,False,False,False,,False,False,,False,,False,False,,False,False,False,False,False,False,False,False,study,study,True
1997,palaeoentomology,Noun,The scientific study of prehistoric insects.,,False,,False,False,False,,False,False,,False,,False,False,,False,False,False,False,False,False,False,False,study,study,True
2032,palaeogenomics,Noun,"The study of ancient genomes, especially those of extinct organisms",,False,,False,False,False,,False,False,,False,,False,False,,False,False,False,False,False,False,False,False,study,study,True
2034,palaeogeochemistry,Noun,The study of the changes in the geochemistry of the Earth over geologic time,,False,,False,False,False,,False,False,,False,,False,False,,False,False,False,False,False,False,False,False,study,study,True
2039,palaeogeography,Noun,"The study of historical geography of the (chiefly physical, but sometimes political/cultural) geography of the world in the geologic past.",,False,,False,False,False,,False,False,,False,,False,False,,False,False,False,False,False,False,False,False,study,study,True
2067,palaeohydrology,Noun,The study of ancient rivers and other hydrological features,,False,,False,False,False,,False,False,,False,,False,False,,False,False,False,False,False,False,False,False,study,study,True
2074,palaeoichthyology,Noun,The scientific study of prehistoric fish.,,False,,False,False,False,,False,False,,False,,False,False,,False,False,False,False,False,False,False,False,study,study,True
2110,palaeomammalogy,Noun,The study of prehistoric mammals,,False,,False,False,False,,False,False,,False,,False,False,,False,False,False,False,False,False,False,False,study,study,True
2201,palaeosalinity,Noun,The study of these salinities,uncountable,False,,False,False,False,,False,False,,False,,False,False,,False,False,False,False,False,False,False,False,study,study,True
2259,palaeoxylology,Noun,"the study of fossil wood, whether petrified or not",sciences,False,,False,False,False,,False,False,,False,,False,False,,False,False,False,False,False,False,False,False,study,study,True
2276,palaetiology,Noun,"The science that explains, by the law of causation, the past condition and changes of the Earth.",,False,,False,False,False,,False,False,,False,,False,False,,False,False,False,False,False,False,False,False,science,science,True
2492,paleanthropology,Noun,"The scientific study of fossil humans, and the evolution of modern man.",American spelling,False,,False,False,False,,False,False,,False,,False,False,,False,False,False,False,False,False,False,False,study,study,True
2530,paleoalgology,Noun,"The study of fossil algae. 1966, United States Joint Publications Research Service, Conferences in the Soviet Bloc - Issue 22, page 10:The conference passed a resolution to publish the works of the conference and also to compile a collection of articles on problems of paleoalgology, which would explain the latest data of a theoretical and applied nature. 1978, Hsinhua Weekly - Issues 1-25, page 24:Paleoalgology is the branch of botany that deals with algae in ancient times. This branch of science is closely related to the studies of the origin of life, ...",,False,,False,False,False,,False,False,,False,,False,False,,False,False,False,False,False,False,False,False,study,study,True
2536,paleoanthropology,Noun,The scientific study of ancient human remains.,anthropology,False,,False,False,False,,False,False,,False,,False,False,,False,False,False,False,False,False,False,False,study,study,True
2547,paleoauxology,Noun,The study of prehistoric change,,False,,False,False,False,,False,False,,False,,False,False,,False,False,False,False,False,False,False,False,study,study,True
2564,paleobiogeography,Noun,The scientific study of the prehistoric distribution of plants and animals.,,False,,False,False,False,,False,False,,False,,False,False,,False,False,False,False,False,False,False,False,study,study,True
2588,paleoceanography,Noun,"The study of the history of the oceans, especially their circulation, chemistry, biogeography, fertility, and sedimentation.",,False,,False,False,False,,False,False,,False,,False,False,,False,False,False,False,False,False,False,False,study,study,True
2663,paleoecology,Noun,The study of ecology in the ancient past.,,False,,False,False,False,,False,False,,False,,False,False,,False,False,False,False,False,False,False,False,study,study,True
2681,paleoepidemiology,Noun,The epidemiological study of disease in ancient times,,False,,False,False,False,,False,False,,False,,False,False,,False,False,False,False,False,False,False,False,study,study,True
2686,paleoethnobotany,Noun,The study of plant remains from archaeological sites.,archaeology,False,,False,False,False,,False,False,,False,,False,False,,False,False,False,False,False,False,False,False,study,study,True
2690,paleoethology,Noun,The study of the behaviour of extinct species of humans.,,False,,False,False,False,,False,False,,False,,False,False,,False,False,False,False,False,False,False,False,study,study,True
2691,paleoethology,Noun,The study of behavior of organisms in the fossil record.,,False,,False,False,False,,False,False,,False,,False,False,,False,False,False,False,False,False,False,False,study,study,True
2741,paleography,Noun,The study of old or ancient forms of writing.[2],,False,,False,False,False,,False,False,,False,,False,False,,False,False,False,False,False,False,False,False,study,study,True
2782,paleoimmunology,Noun,"The study of the ancient roots of the immune system 2015 August 6, Despina Moissidou et al., Invasive versus Non Invasive Methods Applied to Mummy Research: Will This Controversy Ever Be Solved?, in BioMed Research International[1], volume 2015, DOI:10.1155/2015/192829:Advances in paleoimmunology [ 48 50 ] and paleomicrobiology through soft/hard tissue analysis and secretion swabs led to the retrospective diagnosis of several pathogens (e.g., salmonellosis, tuberculosis, malaria, human leishmaniasis, and Chagas disease) in mummies [ 51 67 ] and revealed some of their evolutionary patterns [ 68 ].",,False,,False,False,False,,False,False,,False,,False,False,,False,False,False,False,False,False,False,False,study,study,True
2814,paleolimnology,Noun,The study of the paleoenvironments of inland bodies of water,,False,,False,False,False,,False,False,,False,,False,False,,False,False,False,False,False,False,False,False,study,study,True
2815,paleolinguistics,Noun,The study of the distant human past by linguistic means.,,False,,False,False,False,,False,False,,False,,False,False,,False,False,False,False,False,False,False,False,study,study,True
2816,paleolinguistics,Noun,The study of prehistoric languages using linguistic evidence alone to try to reconstruct them.,,False,,False,False,False,,False,False,,False,,False,False,,False,False,False,False,False,False,False,False,study,study,True
2827,paleology,Noun,The study of antiquities or of the ancient past,,False,,False,False,False,,False,False,,False,,False,False,,False,False,False,False,False,False,False,False,study,study,True
2835,paleomagnetics,Noun,The study of paleomagnetism,,False,,False,False,False,,False,False,,False,,False,False,,False,False,False,False,False,False,False,False,study,study,True
2836,paleomagnetism,Noun,"The study of the strength and direction of the Earth's magnetic field as it has changed over geologic time. 2004, Richard Fortey, The Earth, Folio Society 2011, p. 139: The crucial work on palaeomagnetism was already under way less than ten years after Holmes's first edition.",geology,False,,False,False,False,,False,False,,False,,False,False,,False,False,False,False,False,False,False,False,study,study,True
2857,paleomicrobiology,Noun,The microbiological study of prehistoric material,,False,,False,False,False,,False,False,,False,,False,False,,False,False,False,False,False,False,False,False,study,study,True
2859,paleomicrobiomics,Noun,The study of prehistoric microbiomes,,False,,False,False,False,,False,False,,False,,False,False,,False,False,False,False,False,False,False,False,study,study,True
2871,paleoneurology,Noun,The study of the nervous systems of extinct animals,,False,,False,False,False,,False,False,,False,,False,False,,False,False,False,False,False,False,False,False,study,study,True
2883,paleonutrition,Noun,The study of dietary nutrition in ancient or primitive peoples.,,False,,False,False,False,,False,False,,False,,False,False,,False,False,False,False,False,False,False,False,study,study,True
2905,paleoparasitology,Noun,"The study of ancient parasites, especially as a branch of archaeology",,False,,False,False,False,,False,False,,False,,False,False,,False,False,False,False,False,False,False,False,study,study,True
2912,paleopathology,Noun,The study of ancient diseases,,False,,False,False,False,,False,False,,False,,False,False,,False,False,False,False,False,False,False,False,study,study,True
2917,paleopedology,Noun,The study of geologic soils,geology,False,,False,False,False,,False,False,,False,,False,False,,False,False,False,False,False,False,False,False,study,study,True
2923,paleophysiology,Noun,The scientific study of the evolutionary basis of animal physiology.,,False,,False,False,False,,False,False,,False,,False,False,,False,False,False,False,False,False,False,False,study,study,True
2943,paleoprimatology,Noun,The study of ancient (typically extinct) primates,zoology,False,,False,False,False,,False,False,,False,,False,False,,False,False,False,False,False,False,False,False,study,study,True
2979,paleoseismology,Noun,"The study of ancient rocks and sediments for evidence of seismic events, such as earthquakes and tsunamis, from times before records were kept.",geology,False,,False,False,False,,False,False,,False,,False,False,,False,False,False,False,False,False,False,False,study,study,True
2999,paleostudy,Noun,A paleological study,,False,,False,False,False,,False,False,,False,,False,False,,False,False,False,False,False,False,False,False,study,study,True
3010,paleotempestology,Noun,The study of past tropical cyclone activity by means of geological evidence and historical documentary records.,meteorology,False,,False,False,False,,False,False,,False,,False,False,,False,False,False,False,False,False,False,False,study,study,True
3035,paleovirology,Noun,"The study of ancient, now-extinct viruses.",,False,,False,False,False,,False,False,,False,,False,False,,False,False,False,False,False,False,False,False,study,study,True
3882,palynology,Noun,"The scientific study of spores, pollen and particulate organic matter in various matrices including the air (pollen counts), crime scenes, and sedimentary rocks.",sciences,False,,False,False,False,,False,False,,False,,False,False,,False,False,False,False,False,False,False,False,study,study,True
4372,pancreatology,Noun,The scientific study of the pancreas,,False,,False,False,False,,False,False,,False,,False,False,,False,False,False,False,False,False,False,False,study,study,True
4780,pangenomics,Noun,The study of pangenomes,,False,,False,False,False,,False,False,,False,,False,False,,False,False,False,False,False,False,False,False,study,study,True
5666,panzootics,Noun,The study of panzootic disease,pathology,False,,False,False,False,,False,False,,False,,False,False,,False,False,False,False,False,False,False,False,study,study,True
6299,papyrology,Noun,The study of ancient texts written on papyrus.,,False,,False,False,False,,False,False,,False,,False,False,,False,False,False,False,False,False,False,False,study,study,True
6409,parabiology,Noun,The study of biological paranormal activity,uncommon,False,,False,False,False,,False,False,,False,,False,False,,False,False,False,False,False,False,False,False,study,study,True
6639,paraconsistent logic,Noun,The study of such systems.,"logic, uncountable",False,,False,False,False,,False,False,,False,,False,False,,False,False,False,False,False,False,False,False,study,study,True
7291,paralinguistics,Noun,The study of paralanguage.,,False,,False,False,False,,False,False,,False,,False,False,,False,False,False,False,False,False,False,False,study,study,True
7547,paramagnetics,Noun,The science and technology of paramagnetism and of paramagnetic materials,,False,,False,False,False,,False,False,,False,,False,False,,False,False,False,False,False,False,False,False,science,science,True
7838,paranormalism,Noun,The study of the paranormal.,,False,,False,False,False,,False,False,,False,,False,False,,False,False,False,False,False,False,False,False,study,study,True
8030,paraphysics,Noun,The study of paranormal activity and the occult as it applies to physical phenomena.,,False,,False,False,False,,False,False,,False,,False,False,,False,False,False,False,False,False,False,False,study,study,True
8124,parapsychology,Noun,"The study of that which cannot yet be explained; psychic or occult phenomena, such as telepathy and ghosts.",,False,,False,False,False,,False,False,,False,,False,False,,False,False,False,False,False,False,False,False,study,study,True
8335,parasitology,Noun,A study of parasites.,,False,,False,False,False,,False,False,,False,,False,False,,False,False,False,False,False,False,False,False,study,study,True
8966,paremiology,Noun,The study of proverbs.,,False,,False,False,False,,False,False,,False,,False,False,,False,False,False,False,False,False,False,False,study,study,True
10388,particle mechanics,Noun,The study of the motion of individual particles.,physics,False,,False,False,False,,False,False,,False,,False,False,,False,False,False,False,False,False,False,False,study,study,True
12499,pathoanatomy,Noun,"The study of the causes of disease based on the examination of organs and tissues. 1997, Roy Porter, The Greatest Benefit to Mankind, Folio Society 2016, p. 257: His work laid the foundations for nineteenth-century pathoanatomy, and helps explain why, within a few decades, Cullen and his colleagues had gone the way of Galen.",,False,,False,False,False,,False,False,,False,,False,False,,False,False,False,False,False,False,False,False,study,study,True
12516,pathocenosis,Noun,The study of disease in societies,"pathology, ecology",False,,False,False,False,,False,False,,False,,False,False,,False,False,False,False,False,False,False,False,study,study,True
12559,pathognomonics,Noun,"The study of characteristic indications (pathognomonic signs) of particular diseases. 1734, William Stukeley, Of the Gout, page 39:Without that, 'tis vain to harangue the world with the formal and formidable pomp of tiologics, pathognomonics, procatarctics, prognostics...",,False,,False,False,False,,False,False,,False,,False,False,,False,False,False,False,False,False,False,False,study,study,True
12573,patholinguistics,Noun,The study of language disorders.,,False,,False,False,False,,False,False,,False,,False,False,,False,False,False,False,False,False,False,False,study,study,True
12582,pathological histology,Noun,The study of the microscopic structure of living tissue (histology) of diseased tissue (as opposed to normal histology which studies the histology of healthy tissues).,,False,,False,False,False,,False,False,,False,,False,False,,False,False,False,False,False,False,False,False,study,study,True
12975,patristics,Noun,The study of the works of the early Christian Church Fathers.,,False,,False,False,False,,False,False,,False,,False,False,,False,False,False,False,False,False,False,False,study,study,True
13024,patrology,Noun,The study of the lives and works (especially the writings) of the Church Fathers,,False,,False,False,False,,False,False,,False,,False,False,,False,False,False,False,False,False,False,False,study,study,True
15198,pedagogics,Noun,The science or art of teaching; pedagogy.,,False,,False,False,False,,False,False,,False,,False,False,,False,False,False,False,False,False,False,False,science,science,True
