Unnamed: 0,term,pos,definition,domain,plural,plurality_of_term,obsolete,archaic,abbreviation,abbreviation_for_term,slang,misspelling,misspelling_for_term,initialism,initialism_for_term,vulgar,synonym,synonym_for_term,attribute,property,process,matter,role,measure,units,body,main_noun_nltk,main_noun_maria,field
22554,metapsychology,Noun,The philosophical study of psychology and of the mind.,psychology,False,,False,False,False,,False,False,,False,,False,False,,False,False,False,False,False,False,False,False,study,study,True
22556,metapsychology,Noun,"The study of how human experience forms, filters perception and shapes identity.",philosophy,False,,False,False,False,,False,False,,False,,False,False,,False,False,False,False,False,False,False,False,study,study,True
22769,metastudy,Noun,A study on the topic of studies. This metastudy is designed to find out whether most studies are misleadingly inaccurate.,,False,,False,False,False,,False,False,,False,,False,False,,False,False,False,False,False,False,False,False,study,study,True
22799,metasystematics,Noun,The study of metasystems,,False,,False,False,False,,False,False,,False,,False,False,,False,False,False,False,False,False,False,False,study,study,True
23004,metempiricism,Noun,The science that is concerned with metempirics.,,False,,False,False,False,,False,False,,False,,False,False,,False,False,False,False,False,False,False,False,science,science,True
23059,meteoritics,Noun,"The science that deals with meteors, meteorites, and meteoroids.",astronomy,False,,False,False,False,,False,False,,False,,False,False,,False,False,False,False,False,False,False,False,science,science,True
23085,meteorology,Noun,"The science that deals with the study of the atmosphere and its phenomena, especially with weather and weather forecasting.",,False,,False,False,False,,False,False,,False,,False,False,,False,False,False,False,False,False,False,False,science,science,True
23434,methodology,Noun,The study of methods used in a field.,,False,,False,False,False,,False,False,,False,,False,False,,False,False,False,False,False,False,False,False,study,study,True
23804,methylomics,Noun,The study of methylomes,,False,,False,False,False,,False,False,,False,,False,False,,False,False,False,False,False,False,False,False,study,study,True
24186,metrology,Noun,The science of weights and measures or of measurement.,uncountable,False,,False,False,False,,False,False,,False,,False,False,,False,False,False,False,False,False,False,False,science,science,True
24564,miasmology,Noun,"The study of miasma, or polluted air.",,False,,False,False,False,,False,False,,False,,False,False,,False,False,False,False,False,False,False,False,study,study,True
24798,microacoustics,Noun,The study of very weak or minor sounds.,,False,,False,False,False,,False,False,,False,,False,False,,False,False,False,False,False,False,False,False,study,study,True
25057,microbiomics,Noun,"The study of microbiomes. 2013, Alfredo Guarino, Probiotic Bacteria and Their Effect on Human Health and Well-Being:With microbiomics it is possible to collect enormous amounts of genetic and biological data of microbiota, including benign and pathogenic microorganisms and their host, relatively cheaply and rapidly.",,False,,False,False,False,,False,False,,False,,False,False,,False,False,False,False,False,False,False,False,study,study,True
26103,microfluidics,Noun,"The science concerned with the design and construction of microminiaturized devices containing chambers and tunnels through which fluids flow in a controlled manner; used to construct labs on a chip, ink-jet printer heads etc.",,False,,False,False,False,,False,False,,False,,False,False,,False,False,False,False,False,False,False,False,science,science,True
26104,microfluidics,Noun,The study of microfluids.,physics,False,,False,False,False,,False,False,,False,,False,False,,False,False,False,False,False,False,False,False,study,study,True
26394,microhemodynamics,Noun,The study of blood flow at the microscopic level,,False,,False,False,False,,False,False,,False,,False,False,,False,False,False,False,False,False,False,False,study,study,True
26425,microhistory,Noun,"The study of the past on a small scale, such as an individual neighborhood or town, as a case study for general trends 2009 September 13, Daphne Merkin, Dame of the British Interior, in New York Times[1]:What is certain is that in The Pattern in the Carpet, Drabble eschews both chronology and raw autobiographical revelation for a more meandering approach that touches briefly on family pathology and private pain as it crisscrosses the centuries and unfolds the microhistory of jigsaw puzzles, an English invention, circa 1767.",historical,False,,False,False,False,,False,False,,False,,False,False,,False,False,False,False,False,False,False,False,study,study,True
26690,micrology,Noun,The study of trivialities and minutiae.,,False,,False,False,False,,False,False,,False,,False,False,,False,False,False,False,False,False,False,False,study,study,True
26708,micromagnetics,Noun,The study and application of micromagnetism,physics,False,,False,False,False,,False,False,,False,,False,False,,False,False,False,False,False,False,False,False,study,study,True
26709,micromagnetism,Noun,The study of magnetism at the sub-micrometre scale,physics,False,,False,False,False,,False,False,,False,,False,False,,False,False,False,False,False,False,False,False,study,study,True
26757,micromechanics,Noun,The study of the microscopic behaviour of components of composite materials.,,False,,False,False,False,,False,False,,False,,False,False,,False,False,False,False,False,False,False,False,study,study,True
26782,micromeritics,Noun,The science and technology of small particles.,,False,,False,False,False,,False,False,,False,,False,False,,False,False,False,False,False,False,False,False,science,science,True
26787,micrometabolomics,Noun,The study of the range of metabolites present in a very small biological sample,biochemistry,False,,False,False,False,,False,False,,False,,False,False,,False,False,False,False,False,False,False,False,study,study,True
27055,micropalynology,Noun,"The study of pollen traces 2015 December 24, Taxonomic Characterization of Honey Bee ( Apis mellifera ) Pollen Foraging Based on Non-Overlapping Paired-End Sequencing of Nuclear Ribosomal Loci, in PLOS ONE[1], DOI:10.1371/journal.pone.0145365:To date, comparisons of micropalynology and metagenetics indicate that the latter is effective in identifying pollen sources, but read counts may not be consistently related to visual counts.",,False,,False,False,False,,False,False,,False,,False,False,,False,False,False,False,False,False,False,False,study,study,True
27175,microphonics,Noun,"The science of increasing the intensity of low or weak sounds, or of microphones generally.",dated,False,,False,False,False,,False,False,,False,,False,False,,False,False,False,False,False,False,False,False,science,science,True
27673,microscopy,Noun,"the study of microscopes, their design and manufacture",,False,,False,False,False,,False,False,,False,,False,False,,False,False,False,False,False,False,False,False,study,study,True
27712,microseismology,Noun,The scientific study of microseisms.,,False,,False,False,False,,False,False,,False,,False,False,,False,False,False,False,False,False,False,False,study,study,True
27990,microstudy,Noun,A very small-scale academic study.,,False,,False,False,False,,False,False,,False,,False,False,,False,False,False,False,False,False,False,False,study,study,True
28356,microwave spectroscopy,Noun,The study of the interaction of matter with electromagnetic radiation in the microwave region of the spectrum.,physics,False,,False,False,False,,False,False,,False,,False,False,,False,False,False,False,False,False,False,False,study,study,True
36343,missilery,Noun,The science of missiles.,,False,,False,False,False,,False,False,,False,,False,False,,False,False,False,False,False,False,False,False,science,science,True
37291,mitogenomics,Noun,The study of the complete genome of the mitochondrion of an organism,genetics,False,,False,False,False,,False,False,,False,,False,False,,False,False,False,False,False,False,False,False,study,study,True
37815,mnemonics,Noun,The study of techniques for remembering anything more easily.,plural only,False,,False,False,False,,False,False,,False,,False,False,,False,False,False,False,False,False,False,False,study,study,True
37833,mnemotechny,Noun,The study and practice of improving ones memory.,,False,,False,False,False,,False,False,,False,,False,False,,False,False,False,False,False,False,False,False,study,study,True
38136,mociology,Noun,The study of how people adapt and use wireless technologies.,,False,,False,False,False,,False,False,,False,,False,False,,False,False,False,False,False,False,False,False,study,study,True
38675,modificomics,Noun,The study of posttranslational modifications of the proteins associated with a particular genome,"biochemistry, genetics",False,,False,False,False,,False,False,,False,,False,False,,False,False,False,False,False,False,False,False,study,study,True
39357,molecular dynamics,Noun,The study of the physical movement of collections of atoms and molecules as they interact,physics,False,,False,False,False,,False,False,,False,,False,False,,False,False,False,False,False,False,False,False,study,study,True
39476,molinology,Noun,The study of mills.,,False,,False,False,False,,False,False,,False,,False,False,,False,False,False,False,False,False,False,False,study,study,True
42894,monsterology,Noun,The study of monsters or cryptids.,,False,,False,False,False,,False,False,,False,,False,False,,False,False,False,False,False,False,False,False,study,study,True
42895,monsterology,Noun,The study of the Monster group.,mathematics,False,,False,False,False,,False,False,,False,,False,False,,False,False,False,False,False,False,False,False,study,study,True
43992,moral science,Noun,"The systematic, scientific study of human nature and relationships. Adam Smith conceived of economics as a moral science in the Humean sense.",,False,,False,False,False,,False,False,,False,,False,False,,False,False,False,False,False,False,False,False,study,study,True
44030,moralistics,Noun,The study of morals.,,False,,False,False,False,,False,False,,False,,False,False,,False,False,False,False,False,False,False,False,study,study,True
44474,morology,Noun,The scientific study of nonsense.,humorous,False,,False,False,False,,False,False,,False,,False,False,,False,False,False,False,False,False,False,False,study,study,True
44544,morphemics,Noun,"The study of morphemes, or of the morphemic structure of a language.",linguistics,False,,False,False,False,,False,False,,False,,False,False,,False,False,False,False,False,False,False,False,study,study,True
44611,morphoanatomy,Noun,The study of anatomical forms and structures with emphasis on characteristics useful in distinguishing the species.,"botany, anatomy",False,,False,False,False,,False,False,,False,,False,False,,False,False,False,False,False,False,False,False,study,study,True
44628,morphodynamics,Noun,The study of the changing morphology of geologic surfaces.,geology,False,,False,False,False,,False,False,,False,,False,False,,False,False,False,False,False,False,False,False,study,study,True
44648,morphogenetics,Noun,"The study of morphogenesis. 1963, Advances in Botanical Research[1], ISBN, page 182: The pollen grains are usually very large and well suited for studies in morphogenetics, fine structure, etc. 1990, Roger Wolcott Sperry, Brain Circuits and Functions of the Mind[2], ISBN, page 105: This process relies on the spatiotemporal aspects of morphogenesis, called morphogenetics (Horder and Martin 1978), for the assembly of most of the projection.",biology,False,,False,False,False,,False,False,,False,,False,False,,False,False,False,False,False,False,False,False,study,study,True
44700,morphology,Noun,"A scientific study of form and structure, usually without regard to function. Especially: (linguistics) The study of the internal structure of morphemes (words and their semantic building blocks). 2001, Yehuda Falk, Lexical-Functional Grammar, in CSLI Publications[1], retrieved 2014-02-25: There are many ways to show that word structure is different from phrase and sentence structure. We will mention two here. First, free constituent order in syntax is common cross-linguistically; many languages lack fixed order of the kind that one finds in English. In morphology, on the other hand, order is always fixed. There is no such thing as free morpheme order. Even languages with wildly free word order, such as the Pama-Nyungan (Australian) language Warlpiri (Simpson 1991), have a fixed order of morphemes within the word. Second, syntactic and morphological patterns can differ within the same language. For example, note the difference in English in the positioning of head and complement between syntax and morphology. (biology) The study of the form and structure of animals and plants. (geology) The study of the structure of rocks and landforms. (mathematics) Mathematical morphology.",uncountable,False,,False,False,False,,False,False,,False,,False,False,,False,False,False,False,False,False,False,False,study,study,True
44705,morphomechanics,Noun,The study of (the relationship between) morphology and mechanical properties.,,False,,False,False,False,,False,False,,False,,False,False,,False,False,False,False,False,False,False,False,study,study,True
44713,morphometrics,Noun,The study of the relationships between the form and function of organisms.,biology,False,,False,False,False,,False,False,,False,,False,False,,False,False,False,False,False,False,False,False,study,study,True
44750,morphophysiology,Noun,The (study of the) biological interrelationship between form and physiological function,,False,,False,False,False,,False,False,,False,,False,False,,False,False,False,False,False,False,False,False,study,study,True
44799,morphotectonics,Noun,The study of superficial evidences of tectonic activity.,,False,,False,False,False,,False,False,,False,,False,False,,False,False,False,False,False,False,False,False,study,study,True
45087,mortuary science,Noun,The study of deceased bodies through mortuary work.,,False,,False,False,False,,False,False,,False,,False,False,,False,False,False,False,False,False,False,False,study,study,True
45847,motivology,Noun,The psychological study of people's motives. People studying motivology are hoping to find the motive behind the 2017 Las Vegas shooting.,,False,,False,False,False,,False,False,,False,,False,False,,False,False,False,False,False,False,False,False,study,study,True
52839,musicology,Noun,"the scholarly or scientific study of music, as in historical research, musical theory, or the physical nature of sound.",music,False,,False,False,False,,False,False,,False,,False,False,,False,False,False,False,False,False,False,False,study,study,True
53828,mycobacteriology,Noun,The study of mycobacteria,,False,,False,False,False,,False,False,,False,,False,False,,False,False,False,False,False,False,False,False,study,study,True
53898,mycology,Noun,"The study of fungi, in the wide sense.",,False,,False,False,False,,False,False,,False,,False,False,,False,False,False,False,False,False,False,False,study,study,True
53976,mycoserology,Noun,The study of fungi in the blood,pathology,False,,False,False,False,,False,False,,False,,False,False,,False,False,False,False,False,False,False,False,study,study,True
54013,mycotoxicology,Noun,The study of mycotoxins.,,False,,False,False,False,,False,False,,False,,False,False,,False,False,False,False,False,False,False,False,study,study,True
54529,myology,Noun,"The physiological study of muscles. 2000, M. Yabe, V. G. Sideleva, Myological peculiarities of the comephoridae: an endeimc fish taxon in Lake Baikal (Pisces: Teleostei), K. Minoura (editor), Lake Baikal: A Mirror in Time and Space for Understanding Global Change Processes, page 306, Examination of the myology of the Comephoridae, an endemic fish family in Lake Baikal, has revealed their morphological peculiarities. 2003, Christian de Muizon, Christine Argot, Chapter 4: Comparative anatomy of the Tiupampa didelphimorphs; an approach to locomotory habits of early marsupials, Menna Jones, Mike Archer, Chris Dickman (editors), Predators with Pouches: The Biology of Carnivorous Marsupials, page 61, Given this, there is an urgent need for detailed compared behavioural and anatomical studies of dasyurids, especially focused on osteology, myology and arthrology. 2008, Betty Harper Fussell, Raising Steaks: The Life and Times of American Beef, page 210, He greets me as if I'd been waiting all my life to learn the secrets of Bovine Myology and Muscle Profiling.",anatomy,False,,False,False,False,,False,False,,False,,False,False,,False,False,False,False,False,False,False,False,study,study,True
54789,myriapodology,Noun,The scientific study of myriapods.,,False,,False,False,False,,False,False,,False,,False,False,,False,False,False,False,False,False,False,False,study,study,True
54884,myrmecology,Noun,The study of ants.,zoology,False,,False,False,False,,False,False,,False,,False,False,,False,False,False,False,False,False,False,False,study,study,True
55289,mythonomy,Noun,"The study of myths in general and how they develop, as contrasted with mythology, the study of specific existing myths.",,False,,False,False,False,,False,False,,False,,False,False,,False,False,False,False,False,False,False,False,study,study,True
340,xenoarchaeology,Noun,"A fictional science, concerned with the physical remains of alien cultures. These may be found on planets which have been inhabited or visited by extraterrestrials.",science fiction,False,,False,False,False,,False,False,,False,,False,False,,False,False,False,False,False,False,False,False,science,science,True
360,xenobotany,Noun,"The study of alien plants. 2008, Eric Flint, Dave Freer, Slow Train to Arcturus An oddly lucid part of his stunned mind registered that these were the first fruiting bodies he'd seen. But this was hardly the time for exercising one of the specialties that had got him onto the intercept ship, xenobotany. 2012, David Mack, Star Trek: Vanguard: Storming Heaven Terrell quipped to the new tactical officer, He also holds doctorates in archaeology and xenobotany. So, if you get the urge to debate him about fossils or flowers . . . don't.",science fiction,False,,False,False,False,,False,False,,False,,False,False,,False,False,False,False,False,False,False,False,study,study,True
500,xenology,Noun,The study of alien life.,science fiction,False,,False,False,False,,False,False,,False,,False,False,,False,False,False,False,False,False,False,False,study,study,True
529,xenonatomy,Noun,"The study of alien anatomy. 2000, A.C. Crispin, Time For Yesterday Until yesterday, McCoy had been teaching a course in Xenoanatomy at the Starfleet medical school on Prima, parsecs away. 2008, Joe Haldeman , Marsbound The argument was that decisions had to be made by someone who was not herself a specialist, so she wouldn't give preferential treatment to xenoanatomy or linguistics or whatever. Martian cuisine. 2014, William C Dietz, Drifter's War I took a course in xenoanatomy. We dissected a variety of human corpses. 2015, Tanya Huff , An Ancient Peace I didn't know you were all up on xenoanatomy. I'm not. Ressk set the blade above the uppermost hole in the skull and began to draw the saw back and forth. It caught on the desiccated flesh, bucked, then bit into bone.",science fiction,False,,False,False,False,,False,False,,False,,False,False,,False,False,False,False,False,False,False,False,study,study,True
631,xenotheology,Noun,"The study of alien religion. 2011, Sheri S. Tepper, Raising The Stones ... had added a number of generalists, who had done research in such fields as religious history, xenotheology, deconstruction of scriptures, the anatomy and chemistry of revelation, and the social and economic consequences of prophecy. 2015, John Grant, The Hundredfold Problem The few she'd spoken with so far had proved to be not only more intelligent than herself but also wiser. Of course, it was possible that it was an illusion: one of the first lessons she had learnt in her undergraduate xenotheology courses back at ...",,False,,False,False,False,,False,False,,False,,False,False,,False,False,False,False,False,False,False,False,study,study,True
1368,Ripperology,Noun,"The study of Jack the Ripper, an unidentified serial killer active around the Whitechapel district of London in the late 19th century.",,False,,False,False,False,,False,False,,False,,False,False,,False,False,False,False,False,False,False,False,study,study,True
1649,Romanistics,Noun,The study of Roman law.,law,False,,False,False,False,,False,False,,False,,False,False,,False,False,False,False,False,False,False,False,study,study,True
1650,Romanistics,Noun,The study of Romance languages.,linguistics,False,,False,False,False,,False,False,,False,,False,False,,False,False,False,False,False,False,False,False,study,study,True
1669,Romanology,Noun,The study of Romania and its people.,,False,,False,False,False,,False,False,,False,,False,False,,False,False,False,False,False,False,False,False,study,study,True
1000,Egyptology,Noun,The study of ancient Egypt.,uncountable,False,,False,False,False,,False,False,,False,,False,False,,False,False,False,False,False,False,False,False,study,study,True
1496,Erasmus,Noun,A study period as part of the Erasmus Programme,,False,,False,False,False,,False,False,,False,,False,False,,False,False,False,False,False,False,False,False,study,study,True
1570,Eskimology,Noun,The study of the Eskimo people.,,False,,False,False,False,,False,False,,False,,False,False,,False,False,False,False,False,False,False,False,study,study,True
1590,Esperantology,Noun,The academic study of Esperanto.,,False,,False,False,False,,False,False,,False,,False,False,,False,False,False,False,False,False,False,False,study,study,True
1685,Etruscology,Noun,The study of the Etruscans.,,False,,False,False,False,,False,False,,False,,False,False,,False,False,False,False,False,False,False,False,study,study,True
1393,Palestinianism,Noun,"The study of Palestinian history, anthropology, or archeology",,False,,False,False,False,,False,False,,False,,False,False,,False,False,False,False,False,False,False,False,study,study,True
1411,Palestinology,Noun,The academic study of the culture and genealogy of Palestinians,,False,,False,False,False,,False,False,,False,,False,False,,False,False,False,False,False,False,False,False,study,study,True
243,ufology,Noun,The study of UFOs.,,False,,False,False,False,,False,False,,False,,False,False,,False,False,False,False,False,False,False,False,study,study,True
921,ultrametrics,Noun,The study and use of ultrametric systems,mathematics,False,,False,False,False,,False,False,,False,,False,False,,False,False,False,False,False,False,False,False,study,study,True
1167,ultrasonics,Noun,the science and technology of ultrasound,,False,,False,False,False,,False,False,,False,,False,False,,False,False,False,False,False,False,False,False,science,science,True
11648,unfoldomics,Noun,The study of unfoldomes,biochemistry,False,,False,False,False,,False,False,,False,,False,False,,False,False,False,False,False,False,False,False,study,study,True
14740,universology,Noun,"The science of the universe. 1872, ""Contemporary Literature: Theology and Philosophy,"" Westminster Review, vol. 98, p. 101: Mr. Andrews . . . also finds three primitive laws or fundamental principles of universology, which he calls Unism, Duism, and Trinism.",sometimes capitalized,False,,False,False,False,,False,False,,False,,False,False,,False,False,False,False,False,False,False,False,science,science,True
25807,urban planning,Noun,The science of such design.,,False,,False,False,False,,False,False,,False,,False,False,,False,False,False,False,False,False,False,False,science,science,True
25845,urbanism,Noun,"the study of cities, their geographic, economic, political, social and cultural environment",,False,,False,False,False,,False,False,,False,,False,False,,False,False,False,False,False,False,False,False,study,study,True
26295,urinology,Noun,The study of urine as a way to analyse a patient's health.,,False,,False,False,False,,False,False,,False,,False,False,,False,False,False,False,False,False,False,False,study,study,True
26412,urodynamics,Noun,The (study of the) dynamics of the flow of urine through the urinary tract,physiology,False,,False,False,False,,False,False,,False,,False,False,,False,False,False,False,False,False,False,False,study,study,True
808,Fermiology,Noun,The study of the configuration (shape and size) of Fermi surfaces.,physics,False,,False,False,False,,False,False,,False,,False,False,,False,False,False,False,False,False,False,False,study,study,True
2664,jet propulsion,Noun,The study of devices propelled by jet propulsion,,False,,False,False,False,,False,False,,False,,False,False,,False,False,False,False,False,False,False,False,study,study,True
