Unnamed: 0,term,pos,definition,domain,plural,plurality_of_term,obsolete,archaic,abbreviation,abbreviation_for_term,slang,misspelling,misspelling_for_term,initialism,initialism_for_term,vulgar,synonym,synonym_for_term,attribute,property,process,matter,role,measure,units,body,main_noun_nltk,main_noun_maria,field
111,iatrology,Noun,Medical science.,,False,,False,False,False,,False,False,,False,,False,False,,False,False,False,False,False,False,False,False,science,science,True
859,ichthyopathology,Noun,"The study of diseases of fish. 2012, Edmir Carvalho, Health and Environment in Aquaculture, page 124:Classically the species of Aeromonas implicated in fish disease that have been considered important in ichthyopathology were A. salmonicida and A. hydrophila.",,False,,False,False,False,,False,False,,False,,False,False,,False,False,False,False,False,False,False,False,study,study,True
877,ichthyoplanktology,Noun,"The study of the free-floating larvae of fish 2015 July 6, Molecular Identification of Atlantic Bluefin Tuna ( Thunnus thynnus, Scombridae) Larvae and Development of a DNA Character-Based Identification Key for Mediterranean Scombrids, in PLOS ONE[1], DOI:10.1371/journal.pone.0130407:It comes as no surprise that all 58 larvae provided by the IEO and OCEANA-Marviva project were correctly identified, since their staff are leading experts in the field of ichthyoplanktology.",,False,,False,False,False,,False,False,,False,,False,False,,False,False,False,False,False,False,False,False,study,study,True
991,iconics,Noun,The study of images and symbols as a form of communication.,,False,,False,False,False,,False,False,,False,,False,False,,False,False,False,False,False,False,False,False,study,study,True
1044,iconography,Noun,The study of representative art in general.,,False,,False,False,False,,False,False,,False,,False,False,,False,False,False,False,False,False,False,False,study,study,True
1055,iconology,Noun,The study of icons in art or art history.,,False,,False,False,False,,False,False,,False,,False,False,,False,False,False,False,False,False,False,False,study,study,True
1477,ideogeny,Noun,The science dealing with the origin of ideas.,,False,,False,False,False,,False,False,,False,,False,False,,False,False,False,False,False,False,False,False,science,science,True
1534,ideology,Noun,The study of the origin and nature of ideas.,uncountable,False,,False,False,False,,False,False,,False,,False,False,,False,False,False,False,False,False,False,False,study,study,True
1621,idiography,Noun,The study of individuals,,False,,False,False,False,,False,False,,False,,False,False,,False,False,False,False,False,False,False,False,study,study,True
1663,idiomatology,Noun,"The study of idioms and idiomatic language 1919, H.A. Rose, Comparative ""Idiomatology"", in Man[1], page 133:Mr. Alan Gardiner's Home Thoughts on Language emboldens one to ask whether there is not room for a science of Idiomatology* as a sister to Semantics. 1952, Claire Eileen Craddock, Style theories as found in stylistic studies of Romance scholars, 1900-1950[2], page 32:His aim is language characterization as to its system, a kind of idiomatology. 1978 June 9, George W. Grace, The Langue, in Ethnolinguistic Notes[3], number 2:If we were to identify the langue strictly with the object of linguistic description then one aspect of the problem of defining the langue would involve drawing the line between that aspect of the speakers knowledge of X which is relevant to a linguistic description of X and those aspects (the idiomatology) which are not.",,False,,False,False,False,,False,False,,False,,False,False,,False,False,False,False,False,False,False,False,study,study,True
1793,idiotypy,Noun,"The study or use of ideotypes within medicine. 1984, Heinz Khler, Jacques Urbain, Pierre-Andr Cazenave, Idiotypy in Biology and Medicine, ISBN, page xix:Today a new dimension in idiotypy is developing, which has the potential of broad applications in biology medicine.",,False,,False,False,False,,False,False,,False,,False,False,,False,False,False,False,False,False,False,False,study,study,True
3083,imageology,Noun,"The study of images, especially those produced by medical imaging 2015 July 2, Hao Zeng et al., Comparison of three surgical approaches for cervicothoracic spinal tuberculosis: a retrospective casecontrol study, in Journal of Orthopaedic Surgery and Research[1], volume 10, DOI:10.1186/s13018-015-0238-0:In our study, patients in group B indeed harvested perfect clinical and imageology outcomes during the follow-up (Fig. 2 ); however, the longer operation and hospitalization time, more loss of bleeding, and anteriorposterior routine-related complications made the combined anterior and posterior (AP) approach not applicable to all CTSTBs, except multi-level segments lesion, severe destruction, and complex kyphosis deformity [ 19 ].",,False,,False,False,False,,False,False,,False,,False,False,,False,False,False,False,False,False,False,False,study,study,True
3190,imagology,Noun,"The study of cultural stereotypes as presented in literature etc. 2016, Reingard M. Nischik, On Imagology, Canadian-US Relations, and Popular Culture: National Images and Border Crossings in Margaret Atwoods Works, in Comparative North American Studies, page 93:Applied to American Studies, imagologythe term derives from Latin imago/imageasks not how Americans themselves see America, but how other cultures view the United States. In other words, what is the image of the United States as seen in literatures from outside the United States?",social sciences,False,,False,False,False,,False,False,,False,,False,False,,False,False,False,False,False,False,False,False,study,study,True
4351,immunochemistry,Noun,the study of the structure of antibody molecules (immunoglobulins) and of their ability to bind with antigens of diverse chemical structure,chemistry,False,,False,False,False,,False,False,,False,,False,False,,False,False,False,False,False,False,False,False,study,study,True
4515,immunoecology,Noun,The study of interactions between immunology and ecology,"immunology, ecology",False,,False,False,False,,False,False,,False,,False,False,,False,False,False,False,False,False,False,False,study,study,True
4605,immunogenetics,Noun,"The study of the genetic basis for the immune response, and of the relationships between genetics and immunity from disease","immunology, genetics",False,,False,False,False,,False,False,,False,,False,False,,False,False,False,False,False,False,False,False,study,study,True
4634,immunohematology,Noun,The study of the relationships between disorders of the blood and the immune system,medicine,False,,False,False,False,,False,False,,False,,False,False,,False,False,False,False,False,False,False,False,study,study,True
4762,immunometabolism,Noun,"The study of the interaction between the immune system and metabolism 2015 September 15, Characterization of In Vitro Engineered Human Adipose Tissues: Relevant Adipokine Secretion and Impact of TNF-, in PLOS ONE[1], DOI:10.1371/journal.pone.0137612:In fact, a novel research area termed immunometabolism has emerged from the study of ATs roles in metabolism and immunity, which contribute to the pathogenesis of obesity-associated dysfunctions [23, 24 ].","immunology, biochemistry",False,,False,False,False,,False,False,,False,,False,False,,False,False,False,False,False,False,False,False,study,study,True
4798,immunomorphology,Noun,The study of the relationship between form and function of immunological species such as antigens,immunology,False,,False,False,False,,False,False,,False,,False,False,,False,False,False,False,False,False,False,False,study,study,True
4961,immunoproteomics,Noun,"The study of an immunoproteome 2016 February 24, Identification of Immunoreactive Leishmania infantum Protein Antigens to Asymptomatic Dog Sera through Combined Immunoproteomics and Bioinformatics Analysis, in PLOS ONE[1], DOI:10.1371/journal.pone.0149894:Our results suggest that the combination of immunoproteomics and bioinformatics analyses is a promising method for the identification of novel candidate antigens for vaccine development or with potential use in the development of sensitive diagnostic tests.",biochemistry,False,,False,False,False,,False,False,,False,,False,False,,False,False,False,False,False,False,False,False,study,study,True
5188,immunotoxicology,Noun,The study of dysfunction of the immune system caused by a xenobiotic,,False,,False,False,False,,False,False,,False,,False,False,,False,False,False,False,False,False,False,False,study,study,True
5219,immunovirology,Noun,The study of the interactions between viruses and the immune system,,False,,False,False,False,,False,False,,False,,False,False,,False,False,False,False,False,False,False,False,study,study,True
6171,implantology,Noun,"The science of or techniques involved in dental implants. 2015 December 15, Antibacterial Peptide-Based Gel for Prevention of Medical Implanted-Device Infection, in PLOS ONE[1], DOI:10.1371/journal.pone.0145143:In oral implantology, bacteria are present in dental plaque and along with in the microgap between implant and prosthesis screws on implants.",,False,,False,False,False,,False,False,,False,,False,False,,False,False,False,False,False,False,False,False,science,science,True
12191,infectiology,Noun,"The study of infection 2015 September 24, Individual Monitoring of Immune Response in Atlantic Salmon Salmo salar following Experimental Infection with Infectious Salmon Anaemia Virus (ISAV), in PLOS ONE[1], DOI:10.1371/journal.pone.0137767:We describe here a novel approach to infectiology for salmonid fish where blood samples are collected repeatedly in a small group of PIT-tagged animals.",,False,,False,False,False,,False,False,,False,,False,False,,False,False,False,False,False,False,False,False,study,study,True
13095,information management,Noun,"the study of the acquisition of information from one or more sources, the custodianship and the distribution of that information to those who need it, and its ultimate disposition through archiving or deletion.",,False,,False,False,False,,False,False,,False,,False,False,,False,False,False,False,False,False,False,False,study,study,True
13102,information retrieval,Noun,"The science of searching for information in documents, searching for documents themselves, searching for metadata which describe documents, or searching within databases, whether relational stand-alone databases or hypertextually-networked databases such as the World Wide Web.",information science,False,,False,False,False,,False,False,,False,,False,False,,False,False,False,False,False,False,False,False,science,science,True
13105,information science,Noun,"A broad and interdisciplinary science that deals with the gathering, classification, storage, manipulation, retrieval and analysis of information as an organized resource.",applied science,False,,False,False,False,,False,False,,False,,False,False,,False,False,False,False,False,False,False,False,science,science,True
13190,informetrics,Noun,The study of quantitative aspects of information,"mathematics, computing",False,,False,False,False,,False,False,,False,,False,False,,False,False,False,False,False,False,False,False,study,study,True
13441,infrasonics,Noun,The study and the application of infrasound.,,False,,False,False,False,,False,False,,False,,False,False,,False,False,False,False,False,False,False,False,study,study,True
15747,insectology,Noun,The scientific study of insects.,,False,,False,False,False,,False,False,,False,,False,False,,False,False,False,False,False,False,False,False,study,study,True
17914,interactomics,Noun,The study of the interactions between proteins and other components of a cell,biochemistry,False,,False,False,False,,False,False,,False,,False,False,,False,False,False,False,False,False,False,False,study,study,True
18737,interdisciplinarity,Noun,Any academic or scientific study that draws on the expertise of more than one discipline.,,False,,False,False,False,,False,False,,False,,False,False,,False,False,False,False,False,False,False,False,study,study,True
18974,interferomics,Noun,The study of interferomes,biochemistry,False,,False,False,False,,False,False,,False,,False,False,,False,False,False,False,False,False,False,False,study,study,True
19507,interlinguistics,Noun,"The study of international communication, focused especially on planned international auxiliary languages and having e.g. Esperanto and Interlingua as a chief applied product.",linguistics,False,,False,False,False,,False,False,,False,,False,False,,False,False,False,False,False,False,False,False,study,study,True
20042,international relations,Noun,"The study of relationships among countries, commonly abbreviated as IR.",,False,,False,False,False,,False,False,,False,,False,False,,False,False,False,False,False,False,False,False,study,study,True
20887,intersectionalism,Noun,"The study of minorities within minorities, or intersections between minorities; specifically, the study of the interactions of multiple systems of oppression or discrimination.",,False,,False,False,False,,False,False,,False,,False,False,,False,False,False,False,False,False,False,False,study,study,True
20895,intersectionality,Noun,"The study of (or a sociological methodology of studying) overlapping or intersecting social identities and related systems of oppression, domination, or discrimination. 1989, Kimberl [Williams] Crenshaw, Demarginalizing the Intersection of Race and Sex: A Black Feminist Critique of Antidiscrimination Doctrine, Feminist Theory and Antiracist Politics, in The University of Chicago Legal Forum[1], volume 139, archived from the original on 6 May 2016, page 141:One way to approach the problem of intersectionality is to examine how courts frame and interpret the stories of Black women plaintiffs. 2012, Kalwant Bhopal; John Preston, Introduction: Intersectionality and Race in Education: Theorising Difference, in Kalwant Bhopal and John Preston, editors, Intersectionality and Race in Education, New York, N.Y.; Abingdon, Oxon.: Routledge, ISBN, page 1:This book is about intersectionality and is particularly concerned with examining theorising intersectionalities and difference. In recent years, the concept of intersectionality has taken centre stage and has become a dominant model with which to engage in how differences such as race, gender, class, sexuality, age, disability and religion interweave and intersect upon individual lives in a modern risk society[]. 2016, Patricia Hill Collins; Sirma Bilge, What is Intersectionality?, in Intersectionality (Key Concepts), Cambridge; Malden, Mass.: Polity Press, ISBN:Intersectionality is a way of understanding and analyzing the complexity in the world, in people, and in human experiences. The events and conditions of social and political life and the self can seldom be understood as shaped by one factor. They are generally shaped by many factors in diverse and mutually influencing ways. [] Intersectionality as an analytic tool gives people better access to the complexity of the world and of themselves.",,False,,False,False,False,,False,False,,False,,False,False,,False,False,False,False,False,False,False,False,study,study,True
22129,intracrinology,Noun,The study of intracrine hormones and their related disorders,physiology,False,,False,False,False,,False,False,,False,,False,False,,False,False,False,False,False,False,False,False,study,study,True
24818,ionics,Noun,The study of ionic conductors.,,False,,False,False,False,,False,False,,False,,False,False,,False,False,False,False,False,False,False,False,study,study,True
24866,ionomics,Noun,The study of ionomes,,False,,False,False,False,,False,False,,False,,False,False,,False,False,False,False,False,False,False,False,study,study,True
26823,isoenzymology,Noun,The study of isoenzymes,,False,,False,False,False,,False,False,,False,,False,False,,False,False,False,False,False,False,False,False,study,study,True
27374,isoperimetry,Noun,The study of isoperimetric structures.,mathematics,False,,False,False,False,,False,False,,False,,False,False,,False,False,False,False,False,False,False,False,study,study,True
27403,isophotometry,Noun,"The study, measurement or construction of isophotes",,False,,False,False,False,,False,False,,False,,False,False,,False,False,False,False,False,False,False,False,study,study,True
27807,isotopic chemistry,Noun,"The study of the effects of isotopic substitution on chemical compounds, especially on the kinetics of their reactions.",chemistry,False,,False,False,False,,False,False,,False,,False,False,,False,False,False,False,False,False,False,False,study,study,True
27816,isotopics,Noun,"The study of isotopes, especially stable isotopes.",,False,,False,False,False,,False,False,,False,,False,False,,False,False,False,False,False,False,False,False,study,study,True
292,dactylography,Noun,The science of using fingerprints to uniquely identify people.,,False,,False,False,False,,False,False,,False,,False,False,,False,False,False,False,False,False,False,False,science,science,True
293,dactylography,Noun,The study of finger rings.,,False,,False,False,False,,False,False,,False,,False,False,,False,False,False,False,False,False,False,False,study,study,True
2705,data visualization,Noun,The science of the visual representation of data,,False,,False,False,False,,False,False,,False,,False,False,,False,False,False,False,False,False,False,False,science,science,True
5399,deathlore,Noun,"The study of human aspects of death and the associated grief and rituals; thanatology. 1903, The Gentleman's Magazine, Volume 1, page 554: Enough has been said to show the interest which lies in the study of Bushman folklore in general and the deathlore of the veld in particular. 1975, William Lynwood Montell, Ghosts Along the Cumberland: Deathlore in the Kentucky Foothills 2011, Folklore: An Encyclopedia of Beliefs, Customs, Tales, Music, and Art, page 363: A few examples of material objects included in deathlore are: tombstones, roadside memorials, coffins, and cemeteries.",psychology,False,,False,False,False,,False,False,,False,,False,False,,False,False,False,False,False,False,False,False,study,study,True
10781,degradomics,Noun,the study of all the compounds produced in the degradation of a material (especially of a protease),biochemistry,False,,False,False,False,,False,False,,False,,False,False,,False,False,False,False,False,False,False,False,study,study,True
12429,delphinology,Noun,"The study of dolphins. 2016, Frank Joseph, Our Dolphin Ancestors: Keepers of Lost Knowledge and Healing Wisdom:And yet, only some of the mysteries I wanted to explore lay within the limited purview of delphinology. There were associated spiritual, even paranormal, issuestaboo lines of inquiry shunned by modern sciencethat were too integrally bound up in the whole enigma for dismissal or avoidance.",,False,,False,False,False,,False,False,,False,,False,False,,False,False,False,False,False,False,False,False,study,study,True
12513,deltiology,Noun,The study and collection of postcards.,,False,,False,False,False,,False,False,,False,,False,False,,False,False,False,False,False,False,False,False,study,study,True
13473,demography,Noun,The study of human populations and how they change.,,False,,False,False,False,,False,False,,False,,False,False,,False,False,False,False,False,False,False,False,study,study,True
13631,demonology,Noun,"The study of demons, especially the incantations required to summon and control them. 1990, Terry Pratchett, Eric, page 27:But it wasn't all that strange, because any wizard bright enough to survive for five minutes was also bright enough to realize that if there was any power in demonology, then it lay with the demons.",,False,,False,False,False,,False,False,,False,,False,False,,False,False,False,False,False,False,False,False,study,study,True
14148,dendroarchaeology,Noun,the science that uses dendrochronology to date wooden material from archaeological sites,archaeology,False,,False,False,False,,False,False,,False,,False,False,,False,False,False,False,False,False,False,False,science,science,True
14161,dendrochemistry,Noun,"the science, related to dendrochronology, that uses the analysis of trace minerals in tree rings to study air pollution in past times",chemistry,False,,False,False,False,,False,False,,False,,False,False,,False,False,False,False,False,False,False,False,science,science,True
14166,dendrochronology,Noun,The science that uses the spacing between the annual growth rings of trees to date their exact year of formation.,"biology, archaeology",False,,False,False,False,,False,False,,False,,False,False,,False,False,False,False,False,False,False,False,science,science,True
14172,dendroclimatology,Noun,the science that uses dendrochronology to reconstruct historical climate conditions,,False,,False,False,False,,False,False,,False,,False,False,,False,False,False,False,False,False,False,False,science,science,True
14198,dendroecology,Noun,The science that uses dendrochronology to analyze historic ecological processes.,,False,,False,False,False,,False,False,,False,,False,False,,False,False,False,False,False,False,False,False,science,science,True
14205,dendrogeomorphology,Noun,the science that uses dendrochronology to study changes to the Earth's surface over time,geology,False,,False,False,False,,False,False,,False,,False,False,,False,False,False,False,False,False,False,False,science,science,True
14219,dendrohydrology,Noun,"The science that uses dendrochronology to investigate and reconstruct hydrologic processes, such as river flow and past lake levels.",,False,,False,False,False,,False,False,,False,,False,False,,False,False,False,False,False,False,False,False,science,science,True
14231,dendrology,Noun,the study of trees and other woody plants,,False,,False,False,False,,False,False,,False,,False,False,,False,False,False,False,False,False,False,False,study,study,True
15028,deontic logic,Noun,"The study of obligation, permission, and related concepts.",logic,False,,False,False,False,,False,False,,False,,False,False,,False,False,False,False,False,False,False,False,study,study,True
17176,dermatoglyphics,Noun,The study of such patterns.,,False,,False,False,False,,False,False,,False,,False,False,,False,False,False,False,False,False,False,False,study,study,True
17196,dermatology,Noun,The study of the skin and its diseases,medicine,False,,False,False,False,,False,False,,False,,False,False,,False,False,False,False,False,False,False,False,study,study,True
17224,dermatopathology,Noun,"The study of cutaneous diseases at a microscopic level. 2009 May 3, Emily Murphy, James Beaver, in New York Times[1]:Her father is a professor of pathology at Harvard Medical School and the director of dermatopathology at Brigham and Womens Hospital in Boston.",,False,,False,False,False,,False,False,,False,,False,False,,False,False,False,False,False,False,False,False,study,study,True
17265,dermatovenereology,Noun,The study of the effects of sexually transmitted disease on the skin,,False,,False,False,False,,False,False,,False,,False,False,,False,False,False,False,False,False,False,False,study,study,True
17771,descriptive ethics,Noun,"The study of people's beliefs about morality, in contrast to normative ethics and metaethics.",ethics,False,,False,False,False,,False,False,,False,,False,False,,False,False,False,False,False,False,False,False,study,study,True
20695,developmental biology,Noun,The study of the physiological changes that occurs within individual organisms from their conception through reaching physical maturity.,biology,False,,False,False,False,,False,False,,False,,False,False,,False,False,False,False,False,False,False,False,study,study,True
21789,diabetology,Noun,The study of the diagnosis and treatment of diabetes,medicine,False,,False,False,False,,False,False,,False,,False,False,,False,False,False,False,False,False,False,False,study,study,True
21836,diabology,Noun,The study of the Devil in religion.,,False,,False,False,False,,False,False,,False,,False,False,,False,False,False,False,False,False,False,False,study,study,True
21892,diachrony,Noun,"The study of change over time, especially changes to language",,False,,False,False,False,,False,False,,False,,False,False,,False,False,False,False,False,False,False,False,study,study,True
21913,diaconiology,Noun,The study of the offices and hierarchy of a particular church (organization).,,False,,False,False,False,,False,False,,False,,False,False,,False,False,False,False,False,False,False,False,study,study,True
21916,diacoustics,Noun,The science concerned with the properties of sound as affected by passing through different mediums; diaphonics.,,False,,False,False,False,,False,False,,False,,False,False,,False,False,False,False,False,False,False,False,science,science,True
22143,diagrammatics,Noun,The study of the use of diagrams,,False,,False,False,False,,False,False,,False,,False,False,,False,False,False,False,False,False,False,False,study,study,True
22256,dialectology,Noun,The study of dialects.,,False,,False,False,False,,False,False,,False,,False,False,,False,False,False,False,False,False,False,False,study,study,True
22259,dialectometry,Noun,The study of the regional distribution of dialects.,linguistics,False,,False,False,False,,False,False,,False,,False,False,,False,False,False,False,False,False,False,False,study,study,True
24909,dietetics,Noun,The study of diet and nutrition in relation to health and disease.,,False,,False,False,False,,False,False,,False,,False,False,,False,False,False,False,False,False,False,False,study,study,True
