Unnamed: 0,term,pos,definition,domain,plural,plurality_of_term,obsolete,archaic,abbreviation,abbreviation_for_term,slang,misspelling,misspelling_for_term,initialism,initialism_for_term,vulgar,synonym,synonym_for_term,attribute,property,process,matter,role,measure,units,body,main_noun_nltk,main_noun_maria,field
42992,cognitology,Noun,cognitive science,uncommon,False,,False,False,False,,False,False,,False,,False,False,,False,False,False,False,False,False,False,False,science,science,True
44153,coleopterology,Noun,The scientific study of beetles.,,False,,False,False,False,,False,False,,False,,False,False,,False,False,False,False,False,False,False,False,study,study,True
44507,collateral science,Noun,"A science of importance in medicine but not part of medicine, especially physics, chemistry and botany. Sometimes also including anatomy and physiology.",,False,,False,False,False,,False,False,,False,,False,False,,False,False,False,False,False,False,False,False,science,science,True
44508,collateral science,Noun,A science bearing a similar relationship to some other field.,,False,,False,False,False,,False,False,,False,,False,False,,False,False,False,False,False,False,False,False,science,science,True
44819,collembology,Noun,"The scientific study of springtails, the Collembola.",,False,,False,False,False,,False,False,,False,,False,False,,False,False,False,False,False,False,False,False,study,study,True
45642,colorimetry,Noun,The science of measuring colours and assigning them numeric values.,,False,,False,False,False,,False,False,,False,,False,False,,False,False,False,False,False,False,False,False,science,science,True
45686,colorology,Noun,The scientific study of colour,,False,,False,False,False,,False,False,,False,,False,False,,False,False,False,False,False,False,False,False,study,study,True
47352,comitology,Noun,"The study of how committees could work, expand, and ramify.",humorous,False,,False,False,False,,False,False,,False,,False,False,,False,False,False,False,False,False,False,False,study,study,True
49198,comparative anatomy,Noun,the study of similarities and differences in the anatomy of organisms,,False,,False,False,False,,False,False,,False,,False,False,,False,False,False,False,False,False,False,False,study,study,True
50025,complexity theory,Noun,The study and classification of decision problems by the computational resourcessuch as time and spaceneeded by the programs that solve the problems. The professor of complexity theory says that the problem can be solved in polynomial time.,computer science,False,,False,False,False,,False,False,,False,,False,False,,False,False,False,False,False,False,False,False,study,study,True
50852,computer architecture,Noun,The science of computer design.,computer hardware,False,,False,False,False,,False,False,,False,,False,False,,False,False,False,False,False,False,False,False,science,science,True
50886,computer science,Noun,"The study of computers and their architecture, languages, and applications, in all aspects, as well as the mathematical structures that relate to computers and computation.",,False,,False,False,False,,False,False,,False,,False,False,,False,False,False,False,False,False,False,False,study,study,True
50903,computer vision,Noun,"The science and technology of machines that see, concerned with the theory for building artificial systems that obtain information from images, such as a video sequence, views from multiple cameras, or multi-dimensional data from a medical scanner. 2019 February 3, UN Study: China, US, Japan Lead World AI Development, in Voice of America[1], archived from the original on 7 February 2019:The single most popular AI technology identified in the report was computer vision. .mw-parser-output .k-player .k-attribution{visibility:hidden}Audio (US)(file)",artificial intelligence,False,,False,False,False,,False,False,,False,,False,False,,False,False,False,False,False,False,False,False,science,science,True
50952,computerology,Noun,"The study of computers, or any kind of work with computers; computing.",sometimes informal or humorous,False,,False,False,False,,False,False,,False,,False,False,,False,False,False,False,False,False,False,False,study,study,True
50973,computing,Noun,"The study, field of computers and computer programming. This course will cover several major fields of computing.",,False,,False,False,False,,False,False,,False,,False,False,,False,False,False,False,False,False,False,False,study,study,True
51424,conceptual physics,Noun,"a study and description of properties and interactions of space, time, matter and energy in conceptual non-mathematical form with emphasis on logical reasoning in order to derive fundamental laws of nature and to derive conclusions from these laws.",physics,False,,False,False,False,,False,False,,False,,False,False,,False,False,False,False,False,False,False,False,study,study,True
51705,conchology,Noun,"the study of molluscs and their shells 2011, John Jeremiah Sullivan, Pulphead, The least dreadful among the essays stacked and waiting to be corrected would be that of young Master Jefferson Davis, who when imprisoned by Andrew Johnson in 1866 will ask his physician at Fortress Monroe to procure a few volumes of ""conchology, geology, or botany,"" he desiring to commune with the interests of more innocent days.",,False,,False,False,False,,False,False,,False,,False,False,,False,False,False,False,False,False,False,False,study,study,True
53400,conformational analysis,Noun,The study of the arrangement in space of the constituent atoms of a molecule that may undergo rotation about one or more single bonds,chemistry,False,,False,False,False,,False,False,,False,,False,False,,False,False,False,False,False,False,False,False,study,study,True
54290,conjuncturalism,Noun,The study of the conjunctures that influence interacting cultures.,,False,,False,False,False,,False,False,,False,,False,False,,False,False,False,False,False,False,False,False,study,study,True
54512,connectomics,Noun,The study of the connectivity of synapses in the brain,,False,,False,False,False,,False,False,,False,,False,False,,False,False,False,False,False,False,False,False,study,study,True
54841,conscientiology,Noun,The study of consciousness.,,False,,False,False,False,,False,False,,False,,False,False,,False,False,False,False,False,False,False,False,study,study,True
55047,consequentialism,Noun,"The ethical study of morals, duties and rights with an approach that focuses consequences of a particular action.",ethics,False,,False,False,False,,False,False,,False,,False,False,,False,False,False,False,False,False,False,False,study,study,True
55092,conservation biology,Noun,The scientific study of the state of Earth's biodiversity with the objective to protect it from becoming extinct.,biology,False,,False,False,False,,False,False,,False,,False,False,,False,False,False,False,False,False,False,False,study,study,True
55611,conspiratology,Noun,The study of conspiracies.,,False,,False,False,False,,False,False,,False,,False,False,,False,False,False,False,False,False,False,False,study,study,True
56326,contact linguistics,Noun,The study of language contact,linguistics,False,,False,False,False,,False,False,,False,,False,False,,False,False,False,False,False,False,False,False,study,study,True
59628,copepodology,Noun,The scientific study of copepods.,,False,,False,False,False,,False,False,,False,,False,False,,False,False,False,False,False,False,False,False,study,study,True
63294,cosmeticology,Noun,The science of cosmetic products; cosmetology.,,False,,False,False,False,,False,False,,False,,False,False,,False,False,False,False,False,False,False,False,science,science,True
63302,cosmetology,Noun,the science of cosmetics,,False,,False,False,False,,False,False,,False,,False,False,,False,False,False,False,False,False,False,False,science,science,True
63366,cosmochronology,Noun,The science of determining timescales for astrophysical objects and events.,,False,,False,False,False,,False,False,,False,,False,False,,False,False,False,False,False,False,False,False,science,science,True
63374,cosmoclimatology,Noun,The study of the effects of cosmic rays on the Earth's climate (and weather),,False,,False,False,False,,False,False,,False,,False,False,,False,False,False,False,False,False,False,False,study,study,True
63405,cosmogony,Noun,"The study of the origin, and sometimes the development, of the universe or the solar system, in astrophysics, religion, and other fields.",,False,,False,False,False,,False,False,,False,,False,False,,False,False,False,False,False,False,False,False,study,study,True
63421,cosmography,Noun,The study of the size and geometry of the universe and changes in those with cosmic time.,,False,,False,False,False,,False,False,,False,,False,False,,False,False,False,False,False,False,False,False,study,study,True
63425,cosmokinematics,Noun,"The study of the motion or the universe 2015, Orlando Luongo, Giovanni Battista Pisani, Antonio Troisi, Cosmological degeneracy versus cosmography: a cosmographic dark energy model, in arXiv[1]:In this work we use cosmography to alleviate the degeneracy among cosmological models, proposing a way to parameterize matter and dark energy in terms of cosmokinematics quantities.","physics, astronomy",False,,False,False,False,,False,False,,False,,False,False,,False,False,False,False,False,False,False,False,study,study,True
63460,cosmology,Noun,"The study of the physical universe, its structure, dynamics, origin and evolution, and fate. 2012 January 1, Robert L. Dorit, Rereading Darwin, in American Scientist[1], volume 100, number 1, page 23:We live our lives in three dimensions for our threescore and ten allotted years. Yet every branch of contemporary science, from statistics to cosmology, alludes to processes that operate on scales outside of human experience: the millisecond and the nanometer, the eon and the light-year.",,False,,False,False,False,,False,False,,False,,False,False,,False,False,False,False,False,False,False,False,study,study,True
63461,cosmology,Noun,A metaphysical study into the origin and nature of the universe.,,False,,False,False,False,,False,False,,False,,False,False,,False,False,False,False,False,False,False,False,study,study,True
64849,counter-economics,Noun,The study or practice of all peaceful human action which is forbidden by the State.,economics,False,,False,False,False,,False,False,,False,,False,False,,False,False,False,False,False,False,False,False,study,study,True
66093,counterstudy,Noun,"A study that goes against another study. 2008 June 29, Adam Liptak, Gun Laws and Crime: A Complex Relationship, in New York Times[1]:Then he wrote: The upshot is a set of studies and counterstudies that, at most, could leave a judge uncertain about the proper policy conclusion.",,False,,False,False,False,,False,False,,False,,False,False,,False,False,False,False,False,False,False,False,study,study,True
69131,craniognomy,Noun,The science of the form and characteristics of the skull.,dated,False,,False,False,False,,False,False,,False,,False,False,,False,False,False,False,False,False,False,False,science,science,True
69142,craniology,Noun,The study of the physical characteristics of the human skull.,,False,,False,False,False,,False,False,,False,,False,False,,False,False,False,False,False,False,False,False,study,study,True
69155,craniometrics,Noun,The science of craniometry,,False,,False,False,False,,False,False,,False,,False,False,,False,False,False,False,False,False,False,False,science,science,True
71642,criminology,Noun,"The study of crime and criminals, especially their behaviour.",,False,,False,False,False,,False,False,,False,,False,False,,False,False,False,False,False,False,False,False,study,study,True
72026,criteriology,Noun,"The study of the validity of reasoning and the criteria necessary to achieve knowledge. 1991, Ernest Sosa, Knowledge in Perspective: Selected Essays in Epistemology, ISBN, page 129:But it seems otherwise with reasoning as viewed by criteriology. 1996, Luciano Floridi, Scepticism Ant the Foundation of Epistemology, ISBN:According to Mercier, criteriology should demonstrate the fallacy of two forms of scepticism: one that casts doubts on each of the acts of the human reason and one that casts doubts on the very possibility of arriving at a knowledge of the truth. 2015, Paul Rigby, The Theology of Augustine's Confessions, ISBN, page 17:In the other kind of knowledge, reflection develops a criteriology of the divine to judge whether or not consciousness is testifying to the true God or some phantasm of the divine.",philosophy,False,,False,False,False,,False,False,,False,,False,False,,False,False,False,False,False,False,False,False,study,study,True
75286,cryobiology,Noun,the study of the effects of low temperature on living organisms,,False,,False,False,False,,False,False,,False,,False,False,,False,False,False,False,False,False,False,False,study,study,True
75356,cryoelectronics,Noun,"the study, design and manufacture of electronic components that function at low temperatures; especially those that employ superconductivity",,False,,False,False,False,,False,False,,False,,False,False,,False,False,False,False,False,False,False,False,study,study,True
75364,cryoenzymology,Noun,The study of enzymology at subzero temperatures.,,False,,False,False,False,,False,False,,False,,False,False,,False,False,False,False,False,False,False,False,study,study,True
75412,cryogenics,Noun,The science and technology of the production of very low temperatures.,,False,,False,False,False,,False,False,,False,,False,False,,False,False,False,False,False,False,False,False,science,science,True
75413,cryogenics,Noun,The scientific study of low-temperature phenomena.,,False,,False,False,False,,False,False,,False,,False,False,,False,False,False,False,False,False,False,False,study,study,True
75473,cryology,Noun,The study of snow and ice.,,False,,False,False,False,,False,False,,False,,False,False,,False,False,False,False,False,False,False,False,study,study,True
75474,cryology,Noun,The science of refrigeration.,,False,,False,False,False,,False,False,,False,,False,False,,False,False,False,False,False,False,False,False,science,science,True
75761,cryptanalysis,Noun,The science of analyzing and breaking of codes and ciphers.,,False,,False,False,False,,False,False,,False,,False,False,,False,False,False,False,False,False,False,False,science,science,True
75941,cryptoforestry,Noun,"The study or development of cryptoforests. 2010, Wilfred Hou Je Bek, Cryptoforestry:Cryptoforests are social rejects, urban outsiders and cryptoforestry is an anarchic and primitivist 'art brut'. 2015, Tina Richardson, Introduction: A Wander Through the Scene of British Urban Walking, in Walking Inside Out: Contemporary British Psychogeography, page 18:Practitioners are continually reworking psychogeography and renaming it to suit their requirements and to differentiate what they do from each other. These nuances are very important to psychogeographers (psychogeophysics and cryptoforestry, to provide just two examples). 2016 January 15, Trees that Make History, in The Free Weekly:To some, signal trees, Indian marker trees or Native American trail trees are in the category of cryptoforestry.",,False,,False,False,False,,False,False,,False,,False,False,,False,False,False,False,False,False,False,False,study,study,True
75998,cryptology,Noun,"The science or study of mathematical, linguistic, and other coding patterns and histories.",,False,,False,False,False,,False,False,,False,,False,False,,False,False,False,False,False,False,False,False,science,science,True
76266,crystallochemistry,Noun,The study of the chemical structure of crystals.,,False,,False,False,False,,False,False,,False,,False,False,,False,False,False,False,False,False,False,False,study,study,True
76287,crystallography,Noun,The experimental science of determining the arrangement of atoms in solids.,,False,,False,False,False,,False,False,,False,,False,False,,False,False,False,False,False,False,False,False,science,science,True
76288,crystallography,Noun,The study of crystals.,,False,,False,False,False,,False,False,,False,,False,False,,False,False,False,False,False,False,False,False,study,study,True
80782,cybercriticism,Noun,The critical study of cyberculture.,,False,,False,False,False,,False,False,,False,,False,False,,False,False,False,False,False,False,False,False,study,study,True
81020,cyberlinguistics,Noun,The study of language use on computer systems such as the Internet.,,False,,False,False,False,,False,False,,False,,False,False,,False,False,False,False,False,False,False,False,study,study,True
81221,cyberscience,Noun,Traditional scientific study and research carried out in cyberspace.,uncountable,False,,False,False,False,,False,False,,False,,False,False,,False,False,False,False,False,False,False,False,study,study,True
81402,cybertronics,Noun,The study and design of cybertronic devices (electronic control systems).,,False,,False,False,False,,False,False,,False,,False,False,,False,False,False,False,False,False,False,False,study,study,True
82539,cymatics,Noun,"The study of visible effects of sound and vibration. 1966, Photographic Applications in Science and Technology III, page 83 A 25-minute color film and 50 black-and-white single frames were drawn from Dr. Hans Jennys experiments with cymaticsthe structure and dynamics of waves and vibrations.",physics,False,,False,False,False,,False,False,,False,,False,False,,False,False,False,False,False,False,False,False,study,study,True
82708,cynology,Noun,"The study of dogs. 1892, The Journal of Comparative Medicine and Veterinary Archives, Professor Mills has done excellent work in his course on ""Cynology, the Dog and his Diseases,"" a subject hitherto only taught incidentally in any college ... 1951, The American Mercury, Students of cynology can trace in the dictionary the dog's remarkable rise in the public esteem in this century. 1985, The Complete Dog Book, published by the American Kennel Club, The annals of cynology make no further mention of the breed until 1901 when a combined Rottweiler and Leonberger Club was formed. 1990, Austin Farrer, in his introduction to G. W. Leibniz Theodicy; quoted in Charles Taliaferros 2005 Evidence and Faith, Now neither probatology nor cynology could hope to be universal the world is not all sheep nor all dog: it would have to be hylology; ...",,False,,False,False,False,,False,False,,False,,False,False,,False,False,False,False,False,False,False,False,study,study,True
83350,cytokinetics,Noun,The study of cytokinesis,biology,False,,False,False,False,,False,False,,False,,False,False,,False,False,False,False,False,False,False,False,study,study,True
83367,cytology,Noun,The study of cells.,biology,False,,False,False,False,,False,False,,False,,False,False,,False,False,False,False,False,False,False,False,study,study,True
83420,cytomics,Noun,The study of cytomes,biology,False,,False,False,False,,False,False,,False,,False,False,,False,False,False,False,False,False,False,False,study,study,True
83427,cytomorphology,Noun,The study of the structure of cells.,biology,False,,False,False,False,,False,False,,False,,False,False,,False,False,False,False,False,False,False,False,study,study,True
2791,Boolean algebra,Noun,"The study of such algebras; Boolean logic, classical logic.",mathematics,False,,False,False,False,,False,False,,False,,False,False,,False,False,False,False,False,False,False,False,study,study,True
3784,Buddhology,Noun,The study of the Buddha or Buddhahood.,,False,,False,False,False,,False,False,,False,,False,False,,False,False,False,False,False,False,False,False,study,study,True
3810,Buffyology,Noun,The academic study of the television series Buffy the Vampire Slayer.,,False,,False,False,False,,False,False,,False,,False,False,,False,False,False,False,False,False,False,False,study,study,True
4104,Byzantism,Noun,"The study, or the use of elements of the Byzantine culture",,False,,False,False,False,,False,False,,False,,False,False,,False,False,False,False,False,False,False,False,study,study,True
60,kabbalism,Noun,the study of the Kabbalah,,False,,False,False,False,,False,False,,False,,False,False,,False,False,False,False,False,False,False,False,study,study,True
641,kalology,Noun,"The study of beauty; aesthetics. 1950, William Pepperell Montague, Great visions of philosophy:They are the questions of methodology, of metaphysics, and of kalology. First: What are the ways in which we should attain and verify our knowledge, and how should we interpret truth when we have attained it as subjective and dependent upon our minds, or as objective and identical with reality?",,False,,False,False,False,,False,False,,False,,False,False,,False,False,False,False,False,False,False,False,study,study,True
1279,karyology,Noun,"The study of the nuclei of cells, especially with regard to the chromosomes which they contain.","biology, medicine",False,,False,False,False,,False,False,,False,,False,False,,False,False,False,False,False,False,False,False,study,study,True
2796,keratoprosthetics,Noun,The science of keratoprosthesis.,,False,,False,False,False,,False,False,,False,,False,False,,False,False,False,False,False,False,False,False,science,science,True
2827,keraunomedicine,Noun,The medical study of lightning injuries and casualties.,medicine,False,,False,False,False,,False,False,,False,,False,False,,False,False,False,False,False,False,False,False,study,study,True
5107,killology,Noun,The study of the psychological and physiological effects of killing and combat on the human psyche.,,False,,False,False,False,,False,False,,False,,False,False,,False,False,False,False,False,False,False,False,study,study,True
5416,kinanthropometry,Noun,"The scientific study of human size, shape, and body composition.",,False,,False,False,False,,False,False,,False,,False,False,,False,False,False,False,False,False,False,False,study,study,True
5602,kinemics,Noun,The study of gestures as body language,linguistics,False,,False,False,False,,False,False,,False,,False,False,,False,False,False,False,False,False,False,False,study,study,True
5645,kinesiology,Noun,The study of body movement.,medicine,False,,False,False,False,,False,False,,False,,False,False,,False,False,False,False,False,False,False,False,study,study,True
5677,kinesthesiology,Noun,the medical and therapeutic study of the movement of muscles and joints,,False,,False,False,False,,False,False,,False,,False,False,,False,False,False,False,False,False,False,False,study,study,True
6110,kinodynamics,Noun,"The science of kinodynamic problems. 2014, Maki K. Habib, Handbook of Research on Advancements in Robotics and Mechatronics (page 455) Kinodynamics is the discipline that tries to solve kinematic constraints and dynamical constraints simultaneously. 2013, P. Encarnao, L. Azevedo, G. J. Gelderblom, Assistive Technology: From Research to Practice: AAATE 2013 The great importance of our system lies in the fact that it simulates the kinodynamics of a manually operated wheelchair model (Figure 1) in a fully dynamic virtual environment. An advanced motion planning algorithm has been implemented []",,False,,False,False,False,,False,False,,False,,False,False,,False,False,False,False,False,False,False,False,science,science,True
6124,kinomics,Noun,"The study of the kinome. 2004 March 11, Vieth M, Kinomics-structural biology and chemogenomics of kinase inhibitors and targets., in Biochimica et Biophysica Acta, volume 1697, number 1-2, abstract, page 243:Chemogenomics attempts to combine genomic data, structural biological data, classical dendrograms, and selectivity data to explore, define, and classify the medicinally relevant kinase space. Exploitation of this information in the discovery of kinase inhibitors defines practical kinase chemogenomics (kinomics). 2006, Chemical Modelling: Applications and Theory[1], volume 4, Royal Society of Chemistry, page 16:In this new field of kinomics, approaches like this which combine a simple methodology with high predictive power are very welcome to digest the steadily growing amount of selectivity data. 2009, John M. Walker, Molecular Biology and Biotechnology[2], page 316:Kinomics can be used to understand both the mechanism of action and the specificity of potential drugs.",,False,,False,False,False,,False,False,,False,,False,False,,False,False,False,False,False,False,False,False,study,study,True
7052,kleptography,Noun,The study of stealing information securely and subliminally.,,False,,False,False,False,,False,False,,False,,False,False,,False,False,False,False,False,False,False,False,study,study,True
9136,koniology,Noun,"the study of dust, pollen and other airborne particles.",,False,,False,False,False,,False,False,,False,,False,False,,False,False,False,False,False,False,False,False,study,study,True
9692,kronoseismology,Noun,The study of the propagation of pressure waves in Saturn,astronomy,False,,False,False,False,,False,False,,False,,False,False,,False,False,False,False,False,False,False,False,study,study,True
10254,kymatology,Noun,The study of wave motion.,,False,,False,False,False,,False,False,,False,,False,False,,False,False,False,False,False,False,False,False,study,study,True
4495,Coptology,Noun,The study of the Copts.,,False,,False,False,False,,False,False,,False,,False,False,,False,False,False,False,False,False,False,False,study,study,True
5215,Czech studies,Noun,"An academic study of the Czech language, literature or culture. (This entry is a translation hub.)",,False,,False,False,False,,False,False,,False,,False,False,,False,False,False,False,False,False,False,False,study,study,True
947,Tangutology,Noun,"The study of the Tangut people, culture, and language.",,False,,False,False,False,,False,False,,False,,False,False,,False,False,False,False,False,False,False,False,study,study,True
1704,Thracology,Noun,The study of Ancient Thrace and its culture and antiquities.,,False,,False,False,False,,False,False,,False,,False,False,,False,False,False,False,False,False,False,False,study,study,True
